,0,0,0,0,0
604,全新粉刷，房間漂亮像住飯店優選好屋,雅房 6坪 4F/5F,內湖區-港墘路100巷,距港墘站202公尺,6800
605,美麗華超值雅房近公園捷運大賣場內科優選好屋,雅房 5坪 1F/12F,中山區-敬業三路162巷,no info,8500
606,靜巷一樓雅房分租（降價了）,雅房 6坪 1F/5F,內湖區-金龍路13巷,距內湖站149公尺,8000
607,雅房出租近捷運西湖站350公尺走路4分鐘,雅房 4.5坪 4F/4F,內湖區-內湖路一段323巷,距西湖站280公尺,5500
608,分租雅房有對內窗包水電瓦斯網路(限女)優選好屋,雅房 5坪 2F/4F,南港區-忠孝東路六段,距後山埤站602公尺,7700
609,六張犁/和平東路/富陽街女子公寓雅房出租,雅房 5坪 2F/4F,信義區-富陽街87巷,距麟光站371公尺,8000
610,關渡分租雅房出租,雅房 5坪 4F/5F,北投區-知行路260巷,距關渡站508公尺,5500
611,雙雅房(1人用2間:臥室書房)近師大台大,雅房 10坪 4F/4F,大安區-泰順街,距台電大樓站476公尺,9000
612,近微風廣場大安路雙面採光雅房,雅房 7坪 2F/7F,大安區-大安路一段31巷,距忠孝敦化站386公尺,8500
613,免押金4500,雅房 6坪 4F/4F,信義區-永吉路339號,距松山站543公尺,4500
614,"單或雙人房,師大路附近,生活機能佳!",雅房 5坪 1F/4F,大安區-和平東路一段188巷9號,距台電大樓站608公尺,8500
615,4樓5坪的雅房(有陽台)近師大古亭捷運,雅房 4坪 4F/4F,大安區-潮州街82巷,距古亭站299公尺,5100
616,士林夜市雙衛浴12坪大房間,雅房 12坪 4F/5F,士林區-大北路,距士林站376公尺,10500
617,中正雙捷運1分(高樓層絕美無敵景觀)雅房優選好屋,雅房 5坪 11F/12F,中正區-寧波東街,距中正紀念堂站219公尺,5998
618,通風明亮雅房出租,雅房 5坪 2F/4F,萬華區-中華路130巷54號,no info,6500
619,士林夜市安全安靜雅房,雅房 3坪 1F/3F,士林區-文林路114巷11號,距劍潭站470公尺,3800
620,捷運只需步行5分鐘-近中正紀念堂優質環境,雅房 4坪 4F/5F,中正區-羅斯福路一段58巷,距中正紀念堂站243公尺,7500
621,近市府站4號口全新床家具,雅房 5坪 1F/4F,信義區-基隆路一段35巷,距松山站703公尺,7500
622,萬隆捷運雅房(無窗戶四號出口走路五分鐘),雅房 4坪 3F/5F,文山區-羅斯福路五段218巷35號,距萬隆站201公尺,5000
623,師大古亭捷運、超值高品含水電網路、限女性優選好屋,雅房 5坪 1F/5F,大安區-杭州南路二段93巷74號,距古亭站264公尺,8500
624,捷運西門站1號口雅房短租可,雅房 2坪 2F/6F,萬華區-西寧南路213號,距西門站258公尺,6000
625,南港家庭式雅房，清淨生活機能佳,雅房 5.5坪 3F/4F,南港區-興南街116巷19弄3號,no info,5500
626,近內科、港墘捷運站、(含水、電、網路),雅房 4坪 1F/5F,內湖區-內湖路一段629巷,距港墘站195公尺,7000
627,隣近師大夜市台電大樓三軍總院後面靜謐雅房,雅房 6坪 1F/2F,中正區-永春街212巷7號,距台電大樓站623公尺,6000
628,日式星夜雅房,雅房 4坪 2F/4F,中正區-晉江街,距古亭站172公尺,5500
629,*信義區*松山路*分租套房*分租雅房優選好屋,雅房 4坪 3F/4F,信義區-松山路,距永春站377公尺,6000
630,台電大樓4樓雅房,雅房 4.5坪 4F/5F,中正區-汀洲路三段27巷17號,距台電大樓站283公尺,7800
631,＊德明旁溫馨雅房＊包水電＊冷氣度數另計,雅房 4坪 2F/5F,內湖區-內湖路一段91巷35弄75號,距劍南路站717公尺,6500
632,萬華龍山寺捷運站雅房出租,雅房 7坪 5F/5F,萬華區-和平西路三段,距龍山寺站226公尺,6000
633,公園綠地交通便利生活機能優,雅房 8坪 3F/4F,大安區-瑞安街61巷1弄1號,距科技大樓站332公尺,10000
634,近內湖科學園區，聯發科，德明科技大學,雅房 5坪 4F/5F,內湖區-內湖路一段91巷12弄24號,距西湖站510公尺,5000
635,近政大、木柵捷運、有頂好超市（房間最大）優選好屋,雅房 7坪 5F/5F,文山區-木柵路四段159巷162號,距動物園站600公尺,5300
636,近市府捷運優質雅房,雅房 4坪 2F/4F,信義區-松隆路64號,距市政府370公尺,6900
637,"近東湖捷運,分租雅房(限女性)包水電費優選好屋",雅房 6坪 5F/5F,內湖區-五分街17號,距東湖站127公尺,7500
638,全新裝潢雅房,雅房 7坪 5F/5F,士林區-承德路四段6巷,距劍潭站676公尺,8000
639,內湖捷運站附近優選好屋,雅房 3坪 3F/4F,內湖區-金龍路67巷5弄4號,距內湖站277公尺,6500
640,溫馨優雅房_師大附近優選好屋,雅房 6坪 3F/5F,大安區-師大路68巷,距台電大樓站443公尺,8000
641,小資女學生雅房出租獨立儲物間兩間廁所優選好屋,雅房 6坪 3F/4F,大同區-重慶北路三段25巷28號,距大橋頭站202公尺,6000
642,景美捷運一號出口雅房出租優選好屋,雅房 3.8坪 3F/7F,文山區-景文街,距景美站130公尺,4800
643,南港路雅房出租，近昆陽捷運站,雅房 3坪 4F/5F,南港區-南港路三段67巷,距昆陽站534公尺,5800
644,師大台電大樓捷運新裝潢雅房優選好屋,雅房 5坪 5F/5F,大安區-雲和街,距台電大樓站396公尺,8500
645,雅房，近明德捷運站5分鐘,雅房 5坪 2F/4F,北投區-致遠一路一段90巷14號,距明德站279公尺,6300
646,物超所值女性雅房!!,雅房 5坪 5F/5F,內湖區-康寧路三段165巷20號,距東湖站474公尺,5500
647,近士林站大窗陽臺牆隔間含水電瓦斯,雅房 6坪 3F/4F,士林區-中山北路五段699巷,距士林站480公尺,7800
648,"全包冷氣雅房，含公水電光纖網路,限女生.",雅房 6坪 5F/5F,內湖區-內湖路一段91巷,距劍南路站751公尺,7900
649,NTNUShida師大夜市短租公寓超值,雅房 10坪 4F/5F,大安區-泰順街38巷,距台電大樓站492公尺,5500
650,古亭捷運站走路12分鐘，全新裝潢，家具全,雅房 5坪 5F/5F,中正區-重慶南路三段178號,距古亭站736公尺,13000
651,古亭捷運站走路12分鐘，全新裝潢樣品美屋,雅房 3坪 5F/5F,中正區-重慶南路三段,距古亭站736公尺,7500
652,實踐大學騎車2分及大直捷運站步行2分優選好屋,雅房 5坪 3F/5F,中山區-北安路,距大直站49公尺,7200
653,東門捷運站旁永康商圈溫馨雅房出租,雅房 4.5坪 3F/4F,大安區-永康街13巷,距東門站234公尺,10000
654,近華齡街經濟雅房.押金壹個月.附水費收視,雅房 5坪 B1/5F,士林區-華齡街17巷,距劍潭站677公尺,5000
655,★近士林捷運站旁~雅緻文青雅房★,雅房 4坪 3F/3F,士林區-文林路,距士林站442公尺,7500
656,★中山國小捷運站雙城美食街公寓三樓雅房★,雅房 5坪 3F/3F,中山區-雙城街,距中山國小站401公尺,7000
657,★近劍潭百齡國小公寓亮麗大雅房★,雅房 4.5坪 4F/4F,士林區-和豐街33巷,距劍潭站701公尺,6500
658,限女性雅房出租、近師大分部、臺科大、台大,雅房 5坪 4F/4F,文山區-羅斯福路五段,距萬隆站450公尺,6500
659,近南港展覽館捷運站、南軟園區、中研院,雅房 4坪 4F/4F,南港區-富康街,距南港展覽館站101公尺,7500
660,劍潭捷運10分鐘，適上班族學生，有對外窗優選好屋,雅房 5.5坪 4F/4F,士林區-承德路四段58巷,距劍潭站478公尺,8500
661,@西湖站/德明科大/特惠出清雅房優選好屋,雅房 6坪 3F/4F,內湖區-環山路一段,距西湖站535公尺,6500
662,西湖捷運站雅房(限女生)-德明技術學院旁,雅房 5坪 4F/5F,內湖區-環山路一段,距西湖站490公尺,6500
663,松山路精緻雅房,雅房 5坪 4F/4F,松山區-松山路,距松山站95公尺,11900
664,市府*松山站☀️專屬女性雅房☀️包水電優選好屋,雅房 7坪 5F/5F,信義區-松隆路,距市政府620公尺,8500
665,近大直站/實踐大學/內科-分租雅房,雅房 5坪 3F/7F,中山區-北安路,距大直站33公尺,9000
666,套房：捷運大直站+實踐大學+內湖+大陽台,雅房 6.2坪 4F/4F,中山區-北安路573巷,距大直站166公尺,16500
667,實踐兩分鐘限女優選好屋,雅房 5坪 B1/5F,中山區-大直街,距大直站512公尺,7100
668,雙人床質感房@國際交流共生公寓優選好屋,雅房 6坪 2F/4F,文山區-興隆路一段,距萬隆站253公尺,11800
669,新裝潢近捷運西門站東吳大學家樂福交通便利,雅房 6坪 2F/5F,萬華區-貴陽街二段96巷30號,距龍山寺站541公尺,7500
670,內科文德靜巷*生活機能強*共生公寓雅房*優選好屋,雅房 4坪 4F/4F,內湖區-文德路22巷,距文德站563公尺,10500
671,"精緻雅房!老爺,晶華對面中山捷運一分鐘優選好屋",雅房 5坪 4F/5F,中山區-中山北路二段26巷,距中山站195公尺,6900
672,松山捷運站2分鐘舒適大房間,雅房 5坪 5F/5F,松山區-饒河街227號,距松山站260公尺,13500
673,忠孝復興5分/微風廣場/sogo/限女生,雅房 7坪 3F/5F,松山區-復興南路一段,距忠孝復興站450公尺,9500
674,信義區可寵雅房可合租＿火速秒租中,雅房 7坪 4F/4F,信義區-松山路,距松山站391公尺,11900
675,捷運30秒師大精緻雅房B水電網路全包,雅房 10坪 2F/2F,中正區-師大路136號,距台電大樓站226公尺,13000
676,捷運30秒師大精緻雅房C水網路全包,雅房 6坪 2F/2F,中正區-師大路,距台電大樓站226公尺,12000
677,台電大樓站5分鐘陽光舒適雅房限女性,雅房 4坪 5F/5F,大安區-泰順街54巷,距台電大樓站304公尺,7000
678,雅房~全新家俱裝潢，讓你住在市中,雅房 10坪 2F/2F,大同區-昌吉街132巷,距大橋頭站221公尺,6500
679,公館商圈/限男/室友好相處(免仲介費)優選好屋,雅房 4坪 3F/10F,中正區-思源街,距公館站243公尺,11500
680,景興路獨立雅房(適學生、上班族有管理員),雅房 2.5坪 1F/10F,文山區-景興路177巷11號,距景美站622公尺,8000
681,能使精神自然放鬆且寧靜舒適的雅房,雅房 7.1坪 3F/3F,文山區-木柵路一段58巷,no info,8900
682,古亭台電/男性/含水電瓦斯網路/水泥隔間,雅房 5坪 2F/5F,大安區-浦城街16巷,距古亭站469公尺,9000
683,@@新光醫院分租精緻雅房@@,雅房 3.5坪 6F/7F,士林區-美崙街,距芝山站699公尺,13000
684,可以工作室也可以住優選好屋,雅房 12坪 5F/5F,大同區-萬全街40巷,距雙連站74公尺,14000
685,鉑斯國際🏠世新大學🏠花園式精品雅房,雅房 6坪 3F/3F,文山區-木柵路一段58巷,no info,8500
686,"女生雅房,近中國科大/捷運辛亥萬芳醫院站",雅房 4坪 5F/5F,文山區-福興路78巷,距辛亥608公尺,5000
687,昆陽捷運黃金2樓雅房限女性,雅房 7坪 2F/4F,南港區-忠孝東路六段403巷,距昆陽站51公尺,7500
688,王貫英先生紀念圖書館芳鄰,雅房 7坪 4F/4F,中正區-汀州路二段,距古亭站404公尺,10000
689,古亭捷運站漂亮雅房.客廳廚房可使用.限女優選好屋,雅房 6坪 3F/3F,中正區-廈門街81巷,距古亭站337公尺,10000
690,松山永吉靜巷雅房2600,雅房 10坪 3F/3F,信義區-永吉路180巷54弄1234號,距市政府532公尺,2600
691,忠孝敦化，電梯採光雅房，垃圾代收，大空間優選好屋,雅房 6.5坪 2F/7F,大安區-大安路一段31巷,距忠孝敦化站386公尺,9000
692,採光雅房限女一般用電免費,雅房 5坪 5F/5F,大同區-重慶北路二段57巷,距雙連站653公尺,5500
693,捷運五分鐘對外窗,雅房 3坪 2F/2F,信義區-永吉路278巷,距永春站344公尺,6300
694,近萬隆捷運(2人一衛)可短租台大公館優選好屋,雅房 4坪 5F/5F,文山區-興隆路一段181巷,距萬隆站401公尺,4800
695,古亭站，採光佳雅房，地板新貼，床墊新換優選好屋,雅房 6坪 11F/12F,中正區-南昌路二段,距古亭站333公尺,7500
696,AN85師大首選採光好精品雅房超優優選好屋,雅房 2坪 6F/6F,大安區-浦城街13巷,距台電大樓站480公尺,6900
697,AN83大坪數雅房超級優衛浴不需共用,雅房 5坪 5F/6F,大安區-浦城街13巷,距台電大樓站480公尺,11500
698,AN86精選全新裝潢採光超好雅房首選優選好屋,雅房 3坪 6F/6F,大安區-浦城街13巷,距台電大樓站480公尺,7000
699,可短租，近馬偕超方便，有清潔管理服務優選好屋,雅房 5坪 2F/6F,中山區-中山北路二段72巷,距雙連站158公尺,7900
700,東門捷運站旁，可短租可開伙，清潔管理服務優選好屋,雅房 5坪 3F/3F,大安區-金山南路二段,距東門站172公尺,4400
701,近晴光市場花博公園新裝潢飲水機限女性,雅房 4坪 4F/5F,中山區-雙城街49巷,距中山國小站595公尺,6000
702,離萬隆捷運4號出口近1分鐘,雅房 5坪 B1/5F,文山區-羅斯福路五段212巷,距萬隆站253公尺,6500
703,萬全街/全新裝潢/近雙連站/馬偕醫院,雅房 8坪 5F/5F,大同區-萬全街40巷,距雙連站74公尺,14000
704,短租誠品對面近捷運百貨公司旁,雅房 4坪 3F/12F,大安區-安和路一段11號,距忠孝敦化站207公尺,8500
705,短租誠品對面近捷運百貨公司旁,雅房 12坪 3F/12F,大安區-安和路一段11號,距忠孝敦化站207公尺,12000
706,捷運士林站步行3分鐘且公車多(適男生）優選好屋,雅房 6坪 4F/5F,士林區-中正路201巷,距士林站95公尺,6500
707,台師大古亭捷站1分鐘靜巷境優設備全限女生優選好屋,雅房 8坪 1F/4F,大安區-和平東路一段,距古亭站84公尺,9800
708,捷運士林站6坪雅房上下舖單人床,雅房 6坪 2F/4F,士林區-美德街,距士林站362公尺,8000
709,金石名園區域,雅房 6坪 B1/5F,內湖區-星雲街15巷,距內湖站602公尺,6000
710,近雙連站/寧夏夜市/雅房/馬偕,雅房 8坪 5F/5F,大同區-萬全街40巷,距雙連站74公尺,11000
711,💖限女生💖電梯雅房◆學生免仲介費,雅房 5坪 6F/7F,士林區-文林路,距士林站181公尺,8200
712,西湖捷運站5分鐘#近科學園區#生活機能優優選好屋,雅房 5坪 5F/5F,內湖區-內湖路一段323巷,距西湖站86公尺,6500
713,永春站三分鐘有對外窗獨立曬衣可寵雅房LY,雅房 5坪 3F/4F,信義區-虎林街,距永春站166公尺,8999
714,世新政大东南科技台大近学生女生捷运近,雅房 4坪 1F/1F,文山區-景興路275巷,距景美站413公尺,5000
715,優質雅房包管理費水費瓦斯費優選好屋,雅房 6坪 12F/12F,萬華區-武昌街二段,距西門站344公尺,9800
716,中正高中美麗電梯雅房免服務費優選好屋,雅房 4坪 4F/5F,北投區-文林北路234號,距明德站507公尺,6500
717,西門町捷運站5分鐘可炊雅房出租,雅房 3坪 4F/4F,萬華區-康定路25巷36弄2號,距西門站456公尺,7000
718,分租雅房物超所值！優選好屋,雅房 6坪 2F/5F,萬華區-永福街69號,距龍山寺站532公尺,7200
719,景美透天厝雅房優選好屋,雅房 3坪 2F/3F,文山區-景福街,距景美站318公尺,8000
720,後山埤站2分鐘合租式大窗雅房可寵,雅房 4.5坪 3F/5F,信義區-大道路,距後山埤站381公尺,9500
721,安靜、交通方便近捷運、火車站、雅房,雅房 4坪 3F/3F,萬華區-西園路二段52巷,距龍山寺站558公尺,5500
722,東湖面公園雅房採光佳、有冷氣、含水電,雅房 5坪 5F/5F,內湖區-康樂街61巷6號,距東湖站743公尺,7000
723,近明德捷運站.生活機能良好!!,雅房 7坪 4F/4F,北投區-文林北路80巷,距明德站415公尺,7500
724,師大附近雅房,雅房 3坪 4F/4F,大安區-羅斯福路二段117巷,距古亭站328公尺,5800
725,內科園區/超值大雅房～水電全包！乾淨舒適,雅房 5坪 6F/6F,內湖區-瑞光路,距港墘站506公尺,8000
726,古亭站旁電梯雅房,雅房 7坪 11F/12F,中正區-南昌路二段,距古亭站333公尺,7500
727,萬隆2號出口房東在美國便宜租加賴聯絡,雅房 2.5坪 2F/4F,文山區-興隆路一段184巷,距萬隆站366公尺,4000
728,雅房近大橋頭捷運站1號出口~步行5分鐘優選好屋,雅房 7坪 5F/6F,大同區-伊寧街75巷13號,距大橋頭站384公尺,5500
729,士林捷運站邊5分鐘適合東吳學生/上班族,雅房 4.5坪 3F/3F,士林區-中正路,距士林站360公尺,6000
730,近迪化街公園旁,雅房 5坪 4F/4F,大同區-民樂街163號,距大橋頭站642公尺,5000
731,萬芳實習宿舍出租/近捷運/包水電/以日計,雅房 5坪 2F/5F,文山區-興隆路三段123號,距萬芳醫院站65公尺,6000
732,專人收垃圾打掃送網路近捷運站生活機能佳,雅房 3坪 3F/4F,信義區-永吉路,距市政府652公尺,5200
733,專人收收垃圾送網路近捷運站生活機能佳,雅房 3坪 3F/4F,信義區-永吉路,距市政府652公尺,4800
734,電梯無炊冷氣雅房水泥隔間有窗近J萬隆3號,雅房 5坪 2F/7F,文山區-興隆路一段108號,距萬隆站142公尺,6000
735,單身無炊雅房有窗近捷運永春站1號出口,雅房 3坪 4F/4F,信義區-松信路152號,距永春站504公尺,4600
736,單身無炊雅房有對外窗近捷運永春站1號出口,雅房 4坪 4F/4F,信義區-松信路152號,距永春站504公尺,5600
737,公寓一樓單人雅房,雅房 3坪 1F/6F,中山區-大直街9巷,距大直站92公尺,5000
738,便宜雅房!!近文德捷運站!!,雅房 6坪 5F/5F,內湖區-陽光街92巷,距文德站346公尺,6800
739,捷運士林站雅房出租可住2人,雅房 7坪 2F/4F,士林區-美德街,距士林站362公尺,9000
740,捷運士林站雅房出租,雅房 4坪 2F/4F,士林區-美德街,距士林站362公尺,7500
741,雅房分租/歡迎女性/需正當工作/擔保人,雅房 4坪 4F/5F,信義區-永吉路120巷26號,距市政府543公尺,7000
742,近世新台科徵學生雅房限男(可短租),雅房 4坪 1F/4F,文山區-景華街147巷,距景美站754公尺,5500
743,大安區東門捷運站雅房(限女性)優選好屋,雅房 3.8坪 1F/5F,大安區-信義路二段10巷,距東門站397公尺,6600
744,便利單純寧靜CP值高雅房,雅房 5.5坪 4F/4F,大同區-雙連街1巷17號,距雙連站88公尺,5200
745,生活機能最便利雅房無其他費用優選好屋,雅房 3.5坪 4F/4F,大同區-雙連街1巷17號,距雙連站88公尺,4800
746,南港展覽館捷運1分鐘雅房全新傢俱電,雅房 5坪 3F/4F,南港區-富康街53巷,距南港展覽館站273公尺,7800
747,萬隆捷運站雅房,雅房 4坪 2F/4F,文山區-羅斯福路五段,距萬隆站54公尺,7000
748,"雅房出租,居住環境優，西湖寧靜社區",雅房 5坪 6F/12F,內湖區-內湖路一段411巷,距西湖站393公尺,8200
749,家庭式分租雅房-近昆陽捷運站一分鐘,雅房 3坪 5F/5F,南港區-昆陽街,距昆陽站131公尺,11000
750,面公園樹海港墘站737巷_光、亮裝潢雅房優選好屋,雅房 5.8坪 4F/5F,內湖區-內湖路一段737巷,距港墘站250公尺,8000
751,劍潭站3分鐘對外窗包水電雅房(限女性),雅房 3坪 1F/2F,士林區-中山北路五段190巷,距劍潭站239公尺,4500
752,離捷運260公尺，典雅雅房限女生,雅房 4坪 4F/4F,士林區-大東路,距士林站241公尺,7300
753,內湖康樂雅房-生活機能讚優選好屋,雅房 4坪 頂樓加蓋/5F,內湖區-康樂街72巷,距東湖站742公尺,6000
754,師大採光雅房、交通好、環境單純生活機能佳優選好屋,雅房 4.5坪 3F/7F,大安區-龍泉街,距台電大樓站271公尺,10000
755,屋主自租榮星花園旁電梯雙併華廈大雅房分租優選好屋,雅房 6坪 2F/7F,中山區-民族東路410巷,no info,9500
756,花園社區電梯大樓保全限女近士林劍潭捷運,雅房 4坪 11F/12F,士林區-基河路200號,距士林站426公尺,6000
757,西門捷運。小資漂亮雅房優選好屋,雅房 5坪 3F/5F,萬華區-成都路105巷,距西門站431公尺,6000
758,近景美捷運站雅房,雅房 4坪 3F/5F,文山區-景美街,距景美站379公尺,6000
759,學生宿舍，可短租，請電話聯絡不要留言,雅房 5坪 1F/4F,文山區-景明街14巷,距萬隆站236公尺,5000
760,電梯雅房水泥隔間+獨立陽台近市府站1號,雅房 3坪 4F/12F,信義區-基隆路一段127號,距市政府213公尺,5300
761,政大男生雅房，近捷運動園站,雅房 4坪 5F/5F,文山區-秀明路二段,距木柵站751公尺,6500
762,永春捷運美雅房(限女生ˋ有陽台ˋ廚房ˋ),雅房 6坪 4F/4F,信義區-松山路287巷,距永春站346公尺,11000
763,快！新設備/捷運30秒/有廚房烘衣機優選好屋,雅房 8坪 6F/6F,大同區-萬全街40巷,距雙連站74公尺,8000
764,赤峰街好朋友萬全街好生活機能,雅房 10坪 5F/5F,大同區-萬全街40巷,距雙連站74公尺,12000
765,秒殺雅房!!!誠品/新光三越優質地段,雅房 10坪 5F/5F,大同區-萬全街40巷,距雙連站74公尺,13000
766,一樓711半分鐘到捷運全新設備優選好屋,雅房 10坪 6F/6F,大同區-萬全街40巷,距雙連站74公尺,8500
767,電梯華廈新裝潢採光佳境優近捷運站,雅房 5坪 5F/6F,內湖區-成功路四段61巷,距內湖站302公尺,5800
768,師大分部對面,雅房 5坪 2F/4F,文山區-羅斯福路五段95號,距萬隆站450公尺,5800
769,師大雅房分租，交通購物運動生活機能極佳,雅房 6坪 3F/4F,大安區-師大路102巷11號,距台電大樓站263公尺,7000
770,近師大分部-雅房出租,雅房 3坪 1F/4F,文山區-萬盛街82巷,距萬隆站418公尺,5500
771,大安區公寓雅房出租,雅房 3.5坪 4F/5F,大安區-師大路80巷,距台電大樓站404公尺,6835
772,限男性.古亭站台電大樓站.,雅房 4坪 2F/5F,大安區-麗水街,no info,6000
773,絕版精選雅房優選好屋,雅房 5坪 4F/5F,中正區-重慶南路三段74巷15號,no info,5700
774,世新大學旁一樓雅房-租金半年收SY103,雅房 7坪 1F/4F,文山區-試院路154巷,距景美站673公尺,6000
775,世新大學旁一樓雅房-租金半年收SY102,雅房 5坪 1F/4F,文山區-試院路154巷,距景美站673公尺,5500
776,靜巷雅房近劍潭捷運銘傳大學士林校區,雅房 3坪 4F/5F,士林區-承德路四段58巷,距劍潭站404公尺,6000
777,景美捷運高級門禁大樓全新雅房7300,雅房 3.5坪 2F/14F,文山區-景後街122號,距景美站259公尺,7300
778,北門站/近聯合醫院/北車旁/電梯雅房,雅房 4坪 9F/11F,大同區-延平北路一段,距北門站183公尺,12000
779,圓山捷運艾格設計都會雅房優選好屋,雅房 8坪 3F/4F,大同區-民族西路191號,距圓山610公尺,9500
780,"雅房出租限男性近師大,古亭捷運站,安靜單",雅房 4坪 5F/5F,大安區-浦城街16巷,距台電大樓站473公尺,6500
781,精緻陽光雅房/新裝潢,雅房 4坪 5F/5F,萬華區-和平西路三段13巷,距龍山寺站456公尺,5500
782,雙捷運近夜市靜巷雅房,雅房 4坪 5F/5F,士林區-大北路,距士林站392公尺,4500
783,士林捷運站旁雅房出租,雅房 2坪 3F/3F,士林區-中正路223巷,距士林站140公尺,4500
784,士林優質女子雅房,雅房 5坪 2F/3F,士林區-大北路,距士林站411公尺,6700
785,"新北投捷運對面雅房(有冷氣,冰箱,電視)優選好屋",雅房 4坪 5F/5F,北投區-中和街20巷20號,距新北投184公尺,5000
786,富邦人壽大樓後面優選好屋,雅房 2.5坪 4F/4F,松山區-敦化南路一段100巷,距樂炸特區FUNNYFRIEDZONE488公尺,5200
787,復興北路、捷運站旁雅房出租,雅房 7坪 6F/6F,中山區-江寧里380巷,距中山國中站123公尺,6000
788,雙&單人雅房Sharehouse,雅房 2.5坪 3F/5F,內湖區-東湖路113巷,no info,8000
789,雅房出租(限女性)(包水電不含冷氣電費),雅房 4坪 2F/3F,士林區-褔志路3號,距士林站799公尺,5500
790,文德捷運5分鐘雅房可開伙正5樓專人倒垃圾,雅房 7坪 5F/5F,內湖區-文德路,距文德站448公尺,7000
791,萬芳醫院站新裝潢清幽雅房(限女性),雅房 6坪 5F/5F,文山區-興隆路三段185巷,距萬芳醫院站477公尺,7000
792,挑高雅房出租,雅房 4坪 2F/5F,南港區-興南街,距南港站699公尺,8000
793,萬華區青草園公園旁雅房@5500,雅房 5坪 5F/6F,萬華區-西園路二段50巷,距龍山寺站455公尺,6200
794,台師大溫馨雅房,雅房 4坪 8F/14F,大安區-辛亥路一段,距台電大樓站419公尺,8000
795,台師大全新溫州雅房,雅房 4坪 4F/4F,大安區-羅斯福路三段283巷,距台電大樓站228公尺,8500
796,世新大學電梯純女宿舍,雅房 3坪 4F/4F,文山區-試院路154巷,距景美站610公尺,5600
797,西湖捷運站電梯大雅房釋出!優選好屋,雅房 5坪 5F/8F,內湖區-內湖路一段217巷,距西湖站380公尺,10000
798,古亭捷運套雅房(含冷氣水電全)出租限女性優選好屋,雅房 5坪 2F/4F,中正區-汀州路二段206號,距古亭站459公尺,9800
799,內科最便宜港墘站3分鐘實牆大窗省錢限女優選好屋,雅房 3坪 5F/5F,內湖區-港墘路,距港墘站203公尺,5000
800,景美溫馨雅房出租,雅房 4坪 4F/4F,文山區-景興路,距景美站576公尺,8000
801,永吉路200巷寧靜巷內簡約雅房,雅房 3.5坪 3F/5F,信義區-永吉路200巷,距永春站485公尺,5500
802,近美麗華、內科雅房自租,雅房 5坪 3F/7F,內湖區-文湖街21巷,距劍南路站572公尺,7000
803,內湖區行善路電梯大樓雅房出租,雅房 4坪 3F/8F,內湖區-行善路59巷,距松山站760公尺,6000
804,台大公館商圈3間-近公館捷運站優選好屋,雅房 4坪 4F/4F,中正區-汀州路三段104巷69號,距公館站285公尺,6000
805,永春捷運/採光優質雅房/有代收垃圾優選好屋,雅房 6坪 4F/4F,信義區-松信路,no info,7300
806,近饒河街夜市.松山.市府雙捷運.信義商圈優選好屋,雅房 4坪 5F/5F,信義區-基隆路一段35巷5弄36號,距南京三民站712公尺,5500
807,雅房出租劍潭捷運站8分鐘萬坪公園共2房間,雅房 6坪 6F/6F,士林區-華齡街,距劍潭站540公尺,7500
808,一房一廳雅房優選好屋,雅房 7坪 2F/4F,萬華區-漢口街二段83巷10號,距北門站599公尺,12000
809,永春捷運站一樓可當住家兼工作室!,雅房 3坪 1F/5F,信義區-松山路540巷,距永春站395公尺,9000
810,市府捷運2分鐘性別友善共生公寓,雅房 5坪 3F/4F,信義區-基隆路一段147巷,距市政府130公尺,13500
